{
  "schema_version": "0.1.0",
  "metadata": {
    "ir_id": "ir-0001",
    "created_at": "2026-02-20T12:00:00Z",
    "source": "compiler/m0"
  },
  "goal": "compile and validate a minimal semantic contract",
  "deterministic_nodes": [
    {
      "id": "det-parse-goal",
      "node_class": "deterministic",
      "kind": "parse_goal",
      "inputs": ["source.goal"],
      "outputs": ["ir.goal"]
    }
  ],
  "stochastic_nodes": [
    {
      "id": "sto-refine-prompt",
      "node_class": "stochastic",
      "provider": "openai",
      "prompt": "Refine goal phrasing for adapter output.",
      "temperature": 0.2
    }
  ]
}
